件名,読み仮名,カテゴリー,使用回数
KD物流株式会社,,会社・組織,16
Lib株式会社,,会社・組織,1
くろがね工業株式会社,,会社・組織,1
イーストアジア物流株式会社,,会社・組織,1
カリツーオートテクノ株式会社,,会社・組織,2
ケーエムサービス株式会社,,会社・組織,2
ニッポンロジ株式会社,,会社・組織,1
パッシブル有限会社,,会社・組織,11
フコク物流株式会社,,会社・組織,1
マコトロジテック株式会社,,会社・組織,1
ユニプレス物流株式会社,,会社・組織,12
ラックライド株式会社,,会社・組織,5
三原物流株式会社,,会社・組織,27
三友建設工業株式会社,,会社・組織,5
上田産業株式会社,,会社・組織,1
中村産業輸送株式会社,,会社・組織,2
中野産業株式会社,,会社・組織,17
中野運送　中野正博,,会社・組織,2
丸屋商事株式会社,,会社・組織,4
丸正運送株式会社,,会社・組織,8
久富産業株式会社,,会社・組織,26
九州紙運輸株式会社,,会社・組織,6
九州西濃運輸株式会社,,会社・組織,1
九州運輸建設株式会社,,会社・組織,1
二引株式会社,,会社・組織,1
京築酒類販売株式会社,,会社・組織,1
仲島運送有限会社,,会社・組織,2
佐川急便株式会社,,会社・組織,1
八谷紙工株式会社,,会社・組織,1
凡申産業株式会社,,会社・組織,1
北九州ダイキュー運輸株式会社,,会社・組織,23
北九州産業運輸株式会社,,会社・組織,3
北九州豊運輸株式会社,,会社・組織,2
協栄ライン株式会社,,会社・組織,5
協栄陸運株式会社,,会社・組織,1
協立運輸株式会社,,会社・組織,1
合資会社山下組,,会社・組織,1
周防運輸有限会社,,会社・組織,6
国土交通省大阪航空局北九州空港事務所,,会社・組織,2
塚本精工株式会社,,会社・組織,1
大森運送株式会社,,会社・組織,4
太田古鉄商店,,会社・組織,1
宮田運送株式会社,,会社・組織,2
宮西設備株式会社,,会社・組織,4
寿屋フロンテ株式会社,,会社・組織,1
小倉第一運送有限会社,,会社・組織,1
岡田設備株式会社,,会社・組織,1
嶋本運送株式会社,,会社・組織,1
平和物流株式会社,,会社・組織,38
愛宕自動車工業株式会社,,会社・組織,2
愛岩自動車工業株式会社,,会社・組織,1
新手運輸有限会社,,会社・組織,21
日立金属株式会社九州工場,,会社・組織,1
日通北九州運輸株式会社,,会社・組織,2
曽根金属工業株式会社,,会社・組織,5
曾根金属工業株式会社,,会社・組織,3
有限会社SONEKIN　WORKS,,会社・組織,13
有限会社エコー商会,,会社・組織,4
有限会社エムアイ通商,,会社・組織,6
有限会社オート貿易,,会社・組織,2
有限会社セフティワン,,会社・組織,1
有限会社トス･エクスプレス,,会社・組織,1
有限会社パインカーゴ,,会社・組織,4
有限会社三栄運輸,,会社・組織,5
有限会社中本商会,,会社・組織,1
有限会社井手梱包,,会社・組織,17
有限会社内本開発,,会社・組織,1
有限会社原田運送,,会社・組織,1
有限会社双葉商会,,会社・組織,1
有限会社古井設備,,会社・組織,1
有限会社堀本建設,,会社・組織,21
有限会社大雄産業,,会社・組織,8
有限会社安藤建設,,会社・組織,1
有限会社富永運輸,,会社・組織,1
有限会社岡田運輸,,会社・組織,1
有限会社晃栄建設,,会社・組織,6
有限会社木下金属,,会社・組織,1
有限会社森通商,,会社・組織,1
有限会社水屋,,会社・組織,2
有限会社第一建設工業,,会社・組織,1
有限会社行橋鎮西運送,,会社・組織,20
有限会社西都流通システム,,会社・組織,1
有限会社青浜建設,,会社・組織,3
東和運送株式会社,,会社・組織,1
東洋物産株式会社,,会社・組織,21
東邦興産株式会社,,会社・組織,22
東陸ロジステック株式会社九州事業所,,会社・組織,1
東陸ロジテック株式会社,,会社・組織,3
株式会社D-LITS,,会社・組織,1
株式会社D＆Jロジスティクス,,会社・組織,1
株式会社MLS,,会社・組織,1
株式会社NBSロジソル,,会社・組織,4
株式会社　VIP,,会社・組織,23
株式会社　北九州物流サービス,,会社・組織,9
株式会社みやけ商会,,会社・組織,3
株式会社みらい,,会社・組織,1
株式会社アイエヌトラシード,,会社・組織,1
株式会社アイエヌライン,,会社・組織,4
株式会社アイエヌロジスティクス,,会社・組織,1
株式会社アスリートトラフィック,,会社・組織,4
株式会社アールシーロジ,,会社・組織,1
株式会社エスワイプロモーション,,会社・組織,1
株式会社ガンバコーポレーション,,会社・組織,1
株式会社ケイエム運輸機工,,会社・組織,5
株式会社ケイティトランスポート,,会社・組織,11
株式会社ケーツー企画,,会社・組織,4
株式会社コヤマ物流,,会社・組織,1
株式会社サクラ物流,,会社・組織,86
株式会社ジャパンライン,,会社・組織,1
株式会社ゼロ・プラス九州,,会社・組織,1
株式会社ゼロ九州工場,,会社・組織,2
株式会社ゼロ･プラス九州　九州カスタマーサービスセンター,,会社・組織,1
株式会社ダイワ,,会社・組織,4
株式会社ティー・エル・エス,,会社・組織,1
株式会社デイオー運輸,,会社・組織,1
株式会社バンテック,,会社・組織,97
株式会社バンテック九州,,会社・組織,118
株式会社バンテック海上輸送課,,会社・組織,1
株式会社ヤマガタ本社車輌部,,会社・組織,3
株式会社ユートランス,,会社・組織,3
株式会社ラインシステム,,会社・組織,1
株式会社リアライズコーポレーション,,会社・組織,3
株式会社ロジコム・アイ,,会社・組織,16
株式会社上野商会,,会社・組織,4
株式会社九栄物流,,会社・組織,1
株式会社共和,,会社・組織,4
株式会社前寛商事,,会社・組織,1
株式会社北九州物流サービス,,会社・組織,1
株式会社啓愛社,,会社・組織,2
株式会社坂本産業,,会社・組織,1
株式会社太田古鐵商店,,会社・組織,2
株式会社守エクスプレス,,会社・組織,1
株式会社富士技研,,会社・組織,3
株式会社川村製作所,,会社・組織,1
株式会社日栄紙工社,,会社・組織,1
株式会社日産クリエイティブサービス,,会社・組織,1
株式会社有門組,,会社・組織,1
株式会社東西運輸,,会社・組織,16
株式会社松下運輸,,会社・組織,3
株式会社松本組,,会社・組織,4
株式会社森若商会,,会社・組織,10
株式会社永田興業,,会社・組織,5
株式会社活慎産業,,会社・組織,1
株式会社清翔産業,,会社・組織,8
株式会社牧運輸,,会社・組織,2
株式会社物流なかま,,会社・組織,1
株式会社田北電機製作所,,会社・組織,1
株式会社白石開発,,会社・組織,19
株式会社磯部,,会社・組織,1
株式会社稲田運輸,,会社・組織,2
株式会社翔陸運,,会社・組織,2
株式会社翼LINE,,会社・組織,2
株式会社裕伸,,会社・組織,1
株式会社豊田興業,,会社・組織,1
梶原産業株式会社,,会社・組織,1
河津産業有限会社,,会社・組織,3
無,,会社・組織,3
玄海産業株式会社,,会社・組織,3
現金払い,,会社・組織,2
田村運輸株式会社,,会社・組織,37
田町運送有限会社,,会社・組織,1
福岡化成工業株式会社,,会社・組織,2
興栄産業株式会社,,会社・組織,1
苅田工場部整部門経費,,会社・組織,3
苅田工業部制部門経費,,会社・組織,1
茂木運送有限会社,,会社・組織,1
菊竹産業株式会社,,会社・組織,16
藤原運輸株式会社,,会社・組織,1
藤澤環境開発株式会社,,会社・組織,1
行橋市・みやこ町清掃施設組合,,会社・組織,5
豊工業有限会社,,会社・組織,1
豊能運送株式会社,,会社・組織,2
豊運輸株式会社,,会社・組織,17
長田産業株式会社,,会社・組織,1
香春石灰化学工業株式会社,,会社・組織,3
鶴丸海運株式会社,,会社・組織,40