name,name_norm,is_active,count,example,category,category_name
ヘッドライト,ヘッドライト,true,45,右ヘッドライト取替,engine,エンジン系
エンジンカバー,エンジンカバー,true,11,エンジンカバー脱着,engine,エンジン系
マフラーカバー,マフラーカバー,true,6,マフラーカバー取付,engine,エンジン系
エキゾーストパイプ,エキゾーストパイプ,false,4,エキゾーストパイプ前側腐食切断パチ当て加工溶接,engine,エンジン系
ガードマフラーカバー,ガードマフラーカバー,false,2,サイドガードマフラーカバー曲がり直し,engine,エンジン系
スプリングシート,スプリングシート,true,31,スプリングシート4箇所亀裂カット溶接,suspension,足回り・サスペンション
ミラーアーム,ミラーアーム,true,8,左ミラーアーム交,suspension,足回り・サスペンション
タイヤハウスカバー,タイヤハウスカバー,true,7,タイヤハウスカバー脱着,suspension,足回り・サスペンション
ブッシュゴム,ブッシュゴム,true,7,ブッシュゴム貼替,suspension,足回り・サスペンション
ホイールカバー,ホイールカバー,true,5,ホイールカバー全軸脱着,suspension,足回り・サスペンション
アームプレート,アームプレート,false,2,アームプレート取付穴掘りリベット止め加工（10ミリボルト3セット,suspension,足回り・サスペンション
パイプ,パイプ,true,163,ヒーターパイプ応急溶接,brake,ブレーキ系
テールパイプ,テールパイプ,true,23,テールパイプ取替,brake,ブレーキ系
ジャバラパイプ,ジャバラパイプ,true,16,ジャバラパイプ脱着,brake,ブレーキ系
ガードパイプ,ガードパイプ,true,5,サイドガードコーナーパイプ1本製作切替溶接,brake,ブレーキ系
チャージパイプ,チャージパイプ,false,2,チャージパイプ交換,brake,ブレーキ系
パイプカバー,パイプカバー,false,2,ジャバラパイプカバー,brake,ブレーキ系
パイプクランプ,パイプクランプ,false,2,パイプクランプステー脱着,brake,ブレーキ系
ヒーターパイプ,ヒーターパイプ,false,2,ヒーターパイプ応急溶接,brake,ブレーキ系
ブレーキブラケット,ブレーキブラケット,false,2,サイドブレーキブラケット亀裂溶接,brake,ブレーキ系
折損パイプ,折損パイプ,false,2,折損パイプ取付溶接,brake,ブレーキ系
通しパイプ,通しパイプ,false,2,通しパイプ切替鈑金,brake,ブレーキ系
幌骨パイプ,幌骨パイプ,false,2,左幌骨パイプ腐食部分切断切替加工溶接,brake,ブレーキ系
バンパー,バンパー,true,435,フロントバンパー右異音点検,exterior,外装・ボディ
フェンダー,フェンダー,true,214,左右リアフェンダー脱着,exterior,外装・ボディ
リヤバンパー,リヤバンパー,true,52,リヤバンパー修正鈑金加工,exterior,外装・ボディ
リヤフェンダー,リヤフェンダー,true,21,左リヤフェンダー前側付替,exterior,外装・ボディ
フェンダーステー,フェンダーステー,true,14,フェンダーステー脱着折損部リブ入れ溶接,exterior,外装・ボディ
ドアパネル,ドアパネル,true,12,左ドアパネルASSY取替,exterior,外装・ボディ
バンパーステー,バンパーステー,true,11,バンパーステー引出し,exterior,外装・ボディ
ドアーストリップゴム,ドアーストリップゴム,true,7,右ドアーストリップゴム脱着,exterior,外装・ボディ
フェンダーカバー,フェンダーカバー,true,5,フェンダーカバー交換,exterior,外装・ボディ
ステップバンパー,ステップバンパー,false,4,ステップバンパーボルト取替,exterior,外装・ボディ
バンパーカバー,バンパーカバー,false,4,センターバンパーカバー,exterior,外装・ボディ
ドアーパネル,ドアーパネル,false,3,右ドアーパネル付替,exterior,外装・ボディ
グリルステー,グリルステー,false,2,グリルステー曲がり直し鈑金,exterior,外装・ボディ
ステンフェンダー,ステンフェンダー,false,2,左前ステンフェンダー脱着,exterior,外装・ボディ
バンパーASSY,バンパーASSY,false,2,バンパーASSY交換,exterior,外装・ボディ
フェンダー側,フェンダー側,false,2,左リヤフェンダー前側付替,exterior,外装・ボディ
リヤバンパーステー,リヤバンパーステー,false,2,リヤバンパーステーボルト切断,exterior,外装・ボディ
散水車バンパー,散水車バンパー,false,2,散水車フロントバンパー前側配管取付加工（部品持ち込み）,exterior,外装・ボディ
ランプ,ランプ,true,191,マーカーランプステー切断鈑金取替加工溶接,electrical,灯火・電装系
ライト,ライト,true,91,左ヘッドライト付替,electrical,灯火・電装系
テールランプ,テールランプ,true,38,右テールランプカバー取付,electrical,灯火・電装系
フォグランプ,フォグランプ,true,36,フォグランプカバー取替,electrical,灯火・電装系
テールライト,テールライト,true,15,テールランプ穴切断加工,electrical,灯火・電装系
マーカーランプ,マーカーランプ,true,14,マーカーランプステー切断鈑金取替加工溶接,electrical,灯火・電装系
バックライト,バックライト,true,11,バックランプステー製作取替加工,electrical,灯火・電装系
バックランプ,バックランプ,true,9,左右バックランプ付替え,electrical,灯火・電装系
クランプ,クランプ,true,6,クランプ取替,electrical,灯火・電装系
ランプレンズ,ランプレンズ,true,6,右テールランプレンズ交換,electrical,灯火・電装系
フラッシャーランプ,フラッシャーランプ,false,4,エアホース･コネクター･配線･マーカーランプ･フラッシャーランプ脱着,electrical,灯火・電装系
ステップライト,ステップライト,false,3,ステップライト取替,electrical,灯火・電装系
テールランプブラケット,テールランプブラケット,false,3,テールランプブラケット製作,electrical,灯火・電装系
バックランプステー,バックランプステー,false,3,バックランプステー製作取替加工,electrical,灯火・電装系
リフレクターブラケット,リフレクターブラケット,false,3,リフレクターブラケット脱着修正,electrical,灯火・電装系
反射板プレート,反射板プレート,false,3,左右反射板プレート制作取付加工,electrical,灯火・電装系
カプラースイッチブラケット,カプラースイッチブラケット,false,2,カプラースイッチブラケット取付加工,electrical,灯火・電装系
スイッチステー,スイッチステー,false,2,スイッチステー切断付替え加工,electrical,灯火・電装系
ステンロックスイッチステー,ステンロックスイッチステー,false,2,左右ステンロックスイッチステー脱着Z曲げ加工リベット打ち替え6本,electrical,灯火・電装系
センサーカバー,センサーカバー,false,2,サイドセンサーカバー取替,electrical,灯火・電装系
ハーネスステー,ハーネスステー,false,2,左ハーネスステー脱着,electrical,灯火・電装系
フォグランプカバー,フォグランプカバー,false,2,フォグランプカバー取替,electrical,灯火・電装系
ライトステー,ライトステー,false,2,ライトステー鈑金,electrical,灯火・電装系
ライトブラケット,ライトブラケット,false,2,右ライトブラケット取替,electrical,灯火・電装系
パネル,パネル,true,245,サイドパネル引出し修正,interior,内装・装備
ミラー,ミラー,true,196,アンダーミラー点検応急貼付,interior,内装・装備
シート,シート,true,122,右ウイングシート下側脱着張替,interior,内装・装備
ドライバーシート,ドライバーシート,true,37,ドライバーシートassy脱着,interior,内装・装備
アンダーミラー,アンダーミラー,true,21,アンダーミラー点検応急貼付,interior,内装・装備
バックミラー,バックミラー,true,9,左バックミラーステー脱着応急修正,interior,内装・装備
ウィンドシールドパネル,ウィンドシールドパネル,true,6,ウィンドシールドロアパネル修正錆,interior,内装・装備
ウィングシート,ウィングシート,true,5,ウィングシート破れ部分補修シート貼付コーキング止め6か所,interior,内装・装備
パネルASSY,パネルASSY,true,5,左ドアーパネルASSY交換,interior,内装・装備
ミラーステー,ミラーステー,false,4,右ミラーステー調整,interior,内装・装備
クッションゴム,クッションゴム,false,3,クッションゴム取替貼付２枚,interior,内装・装備
シートブラケット,シートブラケット,false,3,シートブラケット増し締め点検,interior,内装・装備
メッキミラー,メッキミラー,false,3,メッキミラーカバー付替え加工,interior,内装・装備
メッキミラーカバー,メッキミラーカバー,false,3,メッキミラーカバー付替え加工,interior,内装・装備
高速ミラー,高速ミラー,false,3,高速ミラー取替,interior,内装・装備
コボレーンシート,コボレーンシート,false,2,コボレーンシート押え脱着,interior,内装・装備
シートASSY,シートASSY,false,2,ドライバーシートASSY交換,interior,内装・装備
シートカバー,シートカバー,false,2,シートカバー修正取付加工,interior,内装・装備
シールパネル,シールパネル,false,2,右サイドインナーシールパネル応急引出し鈑金,interior,内装・装備
ステップパネル,ステップパネル,false,2,右ステップパネル応急引出し,interior,内装・装備
パネルカバー,パネルカバー,false,2,左コーナーパネルカバー取付,interior,内装・装備
タンクブラケット,タンクブラケット,false,4,タンクブラケット応急曲がり直し,wiper,ワイパー・洗浄
ゴム,ゴム,true,193,ウェザーストリップゴム取替,sealing,シール・ゴム類
泥除けゴム,泥除けゴム,true,34,左右泥除けゴム脱着ブラケット切断脱着曲がり直し付け替え溶接,sealing,シール・ゴム類
ウェザーストリップゴム,ウェザーストリップゴム,true,22,ウェザーストリップゴム取替,sealing,シール・ゴム類
アーチゴム,アーチゴム,true,13,アーチゴム取替加工,sealing,シール・ゴム類
ストリップゴム,ストリップゴム,false,4,左右前後ウィングドアーストリップゴム接着材剝ぎ取り･ストリップゴム接着貼替,sealing,シール・ゴム類
プラットホームゴム,プラットホームゴム,false,4,プラットホームゴム3本取替加工,sealing,シール・ゴム類
戸当たりゴム,戸当たりゴム,false,4,戸当たりゴム脱着,sealing,シール・ゴム類
スプラッシュゴム,スプラッシュゴム,false,3,スプラッシュゴム交換,sealing,シール・ゴム類
スプラッシュシールゴム,スプラッシュシールゴム,false,3,スプラッシュシールゴム取替,sealing,シール・ゴム類
敷ゴム,敷ゴム,false,3,敷ゴム貼替取替,sealing,シール・ゴム類
マッドガードゴム,マッドガードゴム,false,2,左右フロントマッドガードゴム取替加工,sealing,シール・ゴム類
泥除けゴムブラケット,泥除けゴムブラケット,false,2,センター泥除けゴムブラケット取外し取替,sealing,シール・ゴム類
ボルト,ボルト,true,429,押えボルト折れ込み取替加工２本,fastener,ファスナー・取付部品
ステー,ステー,true,423,右ウイング枠骨ステー腐食部分切断付け替え溶接,fastener,ファスナー・取付部品
ブラケット,ブラケット,true,289,左ウイング後ろウイングキャッチブラケット折損部補強リブ取付加工,fastener,ファスナー・取付部品
ガードステー,ガードステー,true,43,左サイドガードステー曲がり直し鈑金,fastener,ファスナー・取付部品
ステップブラケット,ステップブラケット,true,16,ステップブラケット脱着修正,fastener,ファスナー・取付部品
嚙み込みボルト,嚙み込みボルト,true,12,嚙み込みボルト２本切断取替加工,fastener,ファスナー・取付部品
リヤナンバーブラケット,リヤナンバーブラケット,true,10,リヤナンバーブラケット脱着移設加工,fastener,ファスナー・取付部品
突っ張りステー,突っ張りステー,true,10,突っ張りステー取替,fastener,ファスナー・取付部品
工具箱ステー,工具箱ステー,true,9,工具箱ステー左右切替加工溶接2本,fastener,ファスナー・取付部品
ナンバーブラケット,ナンバーブラケット,true,8,ナンバーブラケット修正,fastener,ファスナー・取付部品
ナンバーボルト,ナンバーボルト,true,6,前後ナンバーボルト脱着タップ掛け,fastener,ファスナー・取付部品
作業灯ステー,作業灯ステー,true,6,作業灯ステー4本製作取付加工,fastener,ファスナー・取付部品
折損ボルト,折損ボルト,true,5,折損ボルト取替加工,fastener,ファスナー・取付部品
ステンボルト,ステンボルト,false,4,左前フェンダー分解応急曲がり直し取付（8㎜ステンボルト4セット込み）,fastener,ファスナー・取付部品
ブラケットカバー,ブラケットカバー,false,4,ブラケットカバー,fastener,ファスナー・取付部品
工具箱ブラケット,工具箱ブラケット,false,4,工具箱ブラケット腐食ステー2本切断製作取替溶接,fastener,ファスナー・取付部品
Uボルト,Uボルト,false,3,Uボルト固定溶接1ヶ所,fastener,ファスナー・取付部品
アンダーステー,アンダーステー,false,3,アンダーステー脱着,fastener,ファスナー・取付部品
ガゼットボルト,ガゼットボルト,false,3,ガゼットボルト取付,fastener,ファスナー・取付部品
リヤナンバーボルト,リヤナンバーボルト,false,3,リヤナンバーボルト折れ込み取外し取替,fastener,ファスナー・取付部品
蝶番ボルト,蝶番ボルト,false,3,ウィング蝶番ボルト2本取り付け点検,fastener,ファスナー・取付部品
CIタップボルト,CIタップボルト,false,2,CIタップボルト,fastener,ファスナー・取付部品
UDPCボルト,UDPCボルト,false,2,UDPC取付ボルト折れ込み修理,fastener,ファスナー・取付部品
カバーボルト,カバーボルト,false,2,右ファーストステップカバーボルト２本取替,fastener,ファスナー・取付部品
カプラーガイドブラケット,カプラーガイドブラケット,false,2,右カプラーガイドブラケット脱着切断鈑金溶接,fastener,ファスナー・取付部品
カプラーステー,カプラーステー,false,2,右フレーム曲がり直しカプラーステー鈑金,fastener,ファスナー・取付部品
ステー制作,ステー制作,false,2,左ステー制作取付,fastener,ファスナー・取付部品
バックカメラブラケット,バックカメラブラケット,false,2,バックカメラブラケット制作取付加工,fastener,ファスナー・取付部品
ブラケットボルト,ブラケットボルト,false,2,ブラケットボルト折れ込み修理,fastener,ファスナー・取付部品
ブラケット取りし,ブラケット取りし,false,2,左右観音扉コンパネ入れブラケット取り外し,fastener,ファスナー・取付部品
ブレ止めステー,ブレ止めステー,false,2,ブレ止めステー製作取替加工,fastener,ファスナー・取付部品
ボルト止め,ボルト止め,false,2,荷台内架台修正ボルト止め,fastener,ファスナー・取付部品
ロングボルト,ロングボルト,false,2,ロングボルト2本取替,fastener,ファスナー・取付部品
延長ブラケット,延長ブラケット,false,2,延長ブラケット亀裂カット溶接,fastener,ファスナー・取付部品
押えボルト,押えボルト,false,2,押えボルト折れ込み取替加工２本,fastener,ファスナー・取付部品
穴掘りボルト,穴掘りボルト,false,2,穴掘りボルト２本止め固定加工,fastener,ファスナー・取付部品
固定ボルト,固定ボルト,false,2,固定ボルト1本取替ブッシュ取付加工,fastener,ファスナー・取付部品
根太穴掘りボルト,根太穴掘りボルト,false,2,横根太穴掘りボルト留め加工,fastener,ファスナー・取付部品
床枠ボルト,床枠ボルト,false,2,左右床枠ボルト折れ込み修理2本,fastener,ファスナー・取付部品
折損ステー,折損ステー,false,2,折損ステー取付リブ入れ溶接,fastener,ファスナー・取付部品
幌骨差込ブラケット,幌骨差込ブラケット,false,2,幌骨差込ブラケット折損パイプ取付溶接,fastener,ファスナー・取付部品
踊場枠骨ボルト,踊場枠骨ボルト,false,2,踊場右枠骨ボルト折れ込み取外し取替加工,fastener,ファスナー・取付部品
ガード,ガード,true,588,左右サイドガード亀裂溶接4ヶ所,protection,カバー・プロテクター
カバー,カバー,true,278,安全ガラスアウターカバー脱着異音防止加工,protection,カバー・プロテクター
マッドガード,マッドガード,true,14,マッドガード加工,protection,カバー・プロテクター
アンダーカバー,アンダーカバー,true,9,アンダーカバー取替,protection,カバー・プロテクター
エンドカバー,エンドカバー,true,7,エンドカバー取替え,protection,カバー・プロテクター
ステップカバー,ステップカバー,true,7,左ステップカバー取替,protection,カバー・プロテクター
ガードカバー,ガードカバー,true,5,ガードカバー,protection,カバー・プロテクター
メッキカバー,メッキカバー,false,4,メッキカバー取替,protection,カバー・プロテクター
ファーストステップカバー,ファーストステップカバー,false,3,左ファーストステップロアカバー取替,protection,カバー・プロテクター
ステンガード,ステンガード,false,2,ステンサイドガード折損修正ステン溶接2カ所,protection,カバー・プロテクター
バックガード,バックガード,false,2,バックガード脱着2枚,protection,カバー・プロテクター
リヤカバー,リヤカバー,false,2,リヤカバー,protection,カバー・プロテクター
プレート,プレート,true,64,スカッフプレート脱着,other,その他
スカッフプレート,スカッフプレート,true,16,スカッフプレート脱着,other,その他
ナンバープレート,ナンバープレート,true,8,ナンバープレート封印取外し,other,その他
バックプレート,バックプレート,false,3,バックプレート脱着,other,その他
泥除けプレート,泥除けプレート,false,3,センター泥除けプレート脱着切断加工,other,その他
補強プレート,補強プレート,false,2,補強プレート穴掘り加工取替,other,その他
